{
  "code": "C02",
  "domain": "数据标注与标注质量",
  "family": "drift",
  "kind": "nf-domain-report/1",
  "metrics": {
    "buckets": 8,
    "detail": [
      {
        "actual": 0.100301,
        "bucket": "b0",
        "expected": 0.085901,
        "term": 0.002232
      },
      {
        "actual": 0.108501,
        "bucket": "b1",
        "expected": 0.088701,
        "term": 0.003989
      },
      {
        "actual": 0.168501,
        "bucket": "b2",
        "expected": 0.164201,
        "term": 0.000111
      },
      {
        "actual": 0.095201,
        "bucket": "b3",
        "expected": 0.092801,
        "term": 6.1e-05
      },
      {
        "actual": 0.167201,
        "bucket": "b4",
        "expected": 0.165901,
        "term": 1e-05
      },
      {
        "actual": 0.154801,
        "bucket": "b5",
        "expected": 0.132701,
        "term": 0.003404
      },
      {
        "actual": 0.090901,
        "bucket": "b6",
        "expected": 0.083101,
        "term": 0.0007
      },
      {
        "actual": 0.117201,
        "bucket": "b7",
        "expected": 0.091901,
        "term": 0.006152
      }
    ],
    "digits": 6,
    "family": "drift",
    "note": "样例集上的口径值（非模型能力声明）；口径公式见 docs/domain-packs.md；本报告由 core/domain_metrics.py 确定性复算（T4）",
    "psi": 0.01666,
    "smoothing_epsilon": 1e-06
  },
  "sample": "outputs/samples/CASES.csv",
  "sample_rows": 8
}
